code,name,descr
US,United States,Country in North America known for its diverse economy and technology sector
UK,United Kingdom,Country in Europe comprising England, Scotland, Wales, and Northern Ireland
IN,India,Country in South Asia known for its IT and service industry
CA,Canada,Country in North America known for its natural resources and multicultural society
SG,Singapore,City-state in Southeast Asia known for finance and technology
AU,Australia,Country and continent known for mining, tourism, and education
DE,Germany,Country in Europe known for engineering and manufacturing
ES,Spain,Country in Europe known for culture, tourism, and architecture